{"lote":"C7","data":"2026-10-29","modelo":"claude-sonnet-5-5","esforco":"high","chamadas_usadas":18,
"itens":[
{"id":"C7.1","pergunta":"O caju (Anacardium occidentale L.) é planta nativa do Brasil?",
 "resposta":"Sim, segundo o serviço de dados da Flora e Funga do Brasil (JBRJ): nome aceito, com ocorrência 'Nativa' nos registros de distribuição lidos (BR-PB, BR-MT, BR-CE e outros, não listados todos). O dado é sobre a espécie, não sobre a bebida.",
 "observacao":"Consultado o endpoint de serviço do JBRJ (JSON); a página web FB4381 (aplicação em JavaScript) não foi lida. Dos registros de distribuição só os primeiros foram lidos.",
 "partes":[
 {"afirmacao":"O nome é aceito e a espécie é da Flora e Funga do Brasil.","citacao":"\"scientificname\":\"Anacardium occidentale L.\",\"taxonomicstatus\":\"NOME_ACEITO\" ... \"higherclassification\":\"Flora e Funga;Angiospermas;Anacardiaceae R.Br.;Anacardium L.;Anacardium occidentale L.\"","url":"https://servicos.jbrj.gov.br/flora/taxon/Anacardium%20occidentale","nivel":"oficial"},
 {"afirmacao":"Há registros de ocorrência com origem 'Nativa' e sem endemismo.","citacao":"\"locationid\": \"BR-CE\", \"establishmentmeans\": \"Nativa\", \"occurrenceremarks\": {\"endemism\": \"Não endemica\"","url":"https://servicos.jbrj.gov.br/flora/taxon/Anacardium%20occidentale","nivel":"oficial"},
 {"afirmacao":"O nome vernacular 'caju' consta no mesmo registro.","citacao":"\"vernacularname\": \"caju\", \"language_vernacularname\": \"PORTUGUES\", \"locality_vernacularname\": \"Brasil\"","url":"https://servicos.jbrj.gov.br/flora/taxon/Anacardium%20occidentale","nivel":"oficial"}]},
{"id":"C7.2","pergunta":"Há fermentação no modo de fazer da cajuína? O que cada fonte afirma (sem concluir sobre a prática, D-019)?",
 "resposta":"Cada fonte diz uma coisa. Fontes do acervo (UFC e Embrapa) descrevem a cajuína como não fermentada ou sem álcool e fermento; a norma do MAPA citada por elas (IN 1/2000, Anexo XX) define o suco de caju clarificado ou cajuína como 'bebida não fermentada e não diluída' (texto lido em cópia, nível secundária). Uma Fonte do acervo fala de bebida fermentada dos nativos feita do caju ('caoi ou caoim'), e uma dissertação trata de um fermentado alcoólico feito a partir da cajuína. Há indício secundário de que a IN 1/2000 foi revogada pela IN 49/2018 (não conferido na página oficial). Não se conclui sobre a prática.",
 "observacao":"Interpretação marcada: os trechos de acervo foram lidos nos arquivos acervo/trechos/ (localizados por script), sem reabrir as páginas das Fontes; por isso 'secundária'.",
 "partes":[
 {"afirmacao":"A norma do MAPA (IN 1/2000, Anexo XX) define o suco de caju clarificado ou cajuína como bebida não fermentada (cópia da IN, não o Diário Oficial).","citacao":"Suco de caju clarificado é a bebida não fermentada e não diluída, obtida da parte comestível do pedúnculo do caju (anacardium ocidentale, L.), através de processo tecnológico adequado.","url":"https://laboratorios.ufrrj.br/laab-rural/wp-content/uploads/sites/3/2015/03/IN-01_mapa-Polpas-e-Sucos.pdf","nivel":"secundária"},
 {"afirmacao":"A IN 1/2000 aprovou regulamentos para suco 'caju clarificado ou cajuína' (art. 2º, cópia).","citacao":"e para suco das seguintes frutas: maracujá, caju, caju alto teor de polpa, caju clarificado ou cajuína,","url":"https://laboratorios.ufrrj.br/laab-rural/wp-content/uploads/sites/3/2015/03/IN-01_mapa-Polpas-e-Sucos.pdf","nivel":"secundária"},
 {"afirmacao":"Em 2016 o MAPA submeteu à consulta pública um projeto de IN que revogaria os anexos XVII a XXVII da IN 1/2000 (o Anexo XX é o da cajuína); é projeto, não ato em vigor. A definição do projeto para cajuína não traz a palavra 'fermentado'.","citacao":"Art. 24. Ficam revogados os anexos XVII, XVIII, XIX, XX, XXI, XXII, XXIII, XXIV , XXV , XXVI e XXVII da Instrução Normativa n° 01 de 07 de janeiro de 2000. [...] O suco de caju clarificado é o produto definido no art. 18 do Decreto nº 6.871/2009, obtido da parte comestível do caju (Anacardium occidentale L.), através de processo tecnológico adequado.","url":"https://www.gov.br/agricultura/pt-br/acesso-a-informacao/participacao-social/consultas-publicas/documentos/01_09-secao-1-portaria-86.pdf","nivel":"oficial"},
 {"afirmacao":"A IN MAPA 49/2018 teria revogado a IN 1/2000 (art. 28, I). Só resumo de busca; a página do Diário Oficial devolveu 403 e não foi contornada.","url":"https://www.in.gov.br/web/guest/materia/-/asset_publisher/Kujrw0TZC2Mb/content/id/42586576/do1-2018-09-27-instrucao-normativa-n-49-de-26-","nivel":"não conferido"},
 {"afirmacao":"FO-0006 (Embrapa, 2009) cita a IN 1/2000 e diz que o suco de caju clarificado é bebida não fermentada.","citacao":"De acordo com a Instrução Normativa no 1, de 7 de janeiro de 2000, do Ministério da Agricultura, Pecuária e Abastecimento(1) o suco de caju clarificado é uma bebida não fermentada e não diluída","url":"http://www.infoteca.cnptia.embrapa.br/infoteca/handle/doc/697354","nivel":"secundária"},
 {"afirmacao":"FO-0009 (Embrapa, 2009) diz o mesmo da cajuína, pela norma do Mapa.","citacao":"o suco de caju clarificado, ou cajuína, é uma bebida não fermentada e não diluída, obtida da parte comestível do pedúnculo do caju (Anacardium occidentale, L.), por meio de processo tecnológico adequado.","url":"http://www.infoteca.cnptia.embrapa.br/infoteca/handle/doc/748513","nivel":"secundária"},
 {"afirmacao":"FO-0001 (dissertação, UFC, 2021) diz que a cajuína não possui álcool, fermento e aditivos químicos.","citacao":"A Cajuína é uma bebida leve com sabor característico, que não possui álcool, fermento e aditivos químicos em sua composição.","url":"http://www.repositorio.ufc.br/handle/riufc/58951","nivel":"secundária"},
 {"afirmacao":"FO-0006 (Embrapa, 2009) diz que, entre os usos do caju pelos nativos, havia uma bebida fermentada (o caoi ou caoim). É sobre o caju, e a Fonte não chama essa bebida de cajuína.","citacao":"foi descoberto pelos nativos destas terras, que o utilizavam das mais diversas formas, seja como fruto (in natura), seja como suco extraído por prensagem manual ou como bebida fermentada (o caoi ou caoim)","url":"http://www.infoteca.cnptia.embrapa.br/infoteca/handle/doc/697354","nivel":"secundária"},
 {"afirmacao":"FO-0003 (dissertação, UFC, 2024) tem por objeto um fermentado alcoólico feito a partir da cajuína (título da Fonte; não é afirmação sobre o modo tradicional).","citacao":"Fermentado alcoólico acidificado de cajuína, tipo sidra, como proposta de aproveitamento do pedúnculo de caju","url":"http://repositorio.ufc.br/handle/riufc/78207","nivel":"secundária"}]}
],
"nao_conferido":["C7.2: vigência atual da IN 1/2000 e o texto da IN 49/2018 (in.gov.br respondeu 403, sem contorno); a definição de suco de caju clarificado na norma vigente.","C7.2: o texto oficial da IN 1/2000 no Diário Oficial ou no Sislegis (lido só em cópia de universidade).","C7.2: as páginas das Fontes não foram reabertas; os trechos vêm de acervo/trechos/.","C7.1: lista completa dos estados e da página web FB4381 da Flora e Funga."]}
